"easyvente";"VA1962-EASYVENTE";"vente";"appartement";"73610";"Saint-Alban-de-Montbel";"FR";"5301 Rue du Lac";"";"";"237900";"";"";"NON";"0";"65";"";"4";"3";"2 appartements à vendre ";"Lot de 2 appartements à vendre, dont<br>Un duplex de 65 m2 avec un jardin de 600 m2 en bordure de rivière privée. Au premier étage, vous entrez dans un séjour, cuisine ouverte, soleil traversant, ainsi que des toilettes, au deuxième étage, trois chambres avec leurs rangements, ainsi qu'une salle d'eau avec toilettes.<br>En rez de chaussée, un appartement T1 bis de 50 M2 se composant d'une cuisine aménagée et d'une grande pièce pouvant être aménagée grâce à une verrière en coté chambre avec dressing, puis de l'autre coté en séjour. Ce bien a un jardin en commun ainsi qu'un accès à la rivière. Cet appartement peut être loué 700 euros par mois, charges comprises.<br><br>Vous désirez vivre à la campagne et travailler en ville, la gare SNCF est à 5 minutes, ligne Chambéry / Lyon.<br>Bien desservi par les bus scolaire et transports en commun.<br>Ecole maternelle et primaire, crèche à Saint Alban de Montbel.<br>Collège à Novalaise.<br>Lycée à Chambéry.<br>10 minutes de Pont de Beauvoisin et 20 minutes de Chambéry.<br>A visiter...<br>Mandat N° 18031109. Honoraires à la charge du vendeur.  <br>";"";"0";"1";"2";"NON";"1950";"";"0";"1";"1";"";"8192";"";"OUI";"";"OUI";"";"0";"0";"";"";"0";"0";"";"";"";"NON";"";"";"";"";"";"";"";"";"";"";"";"";"";"";"";"";"";"";"";"";"";"";"";"";"";"";"";"";"";"OUI";"";"";"";"";"";"";"https://img.netty.immo/productw/easyvente/2/VA1962/1554812659_VA1962_11_l.jpg";"https://img.netty.immo/productw/easyvente/2/VA1962/1554812728_VA1962_10_l.jpg";"https://img.netty.immo/productw/easyvente/2/VA1962/1555250295_VA1962_8_l.jpg";"https://img.netty.immo/productw/easyvente/2/VA1962/1554812410_VA1962_2_l.jpg";"https://img.netty.immo/productw/easyvente/2/VA1962/1554812425_VA1962_1_l.jpg";"https://img.netty.immo/productw/easyvente/2/VA1962/1554812440_VA1962_3_l.jpg";"https://img.netty.immo/productw/easyvente/2/VA1962/1554812453_VA1962_4_l.jpg";"https://img.netty.immo/productw/easyvente/2/VA1962/1554812475_VA1962_5_l.jpg";"https://img.netty.immo/productw/easyvente/2/VA1962/1554812489_VA1962_6_l.jpg";"";"";"";"";"";"";"";"";"";"";"";"0612255693";"Sylvie Pontille";"contact@easyventeimmo.fr";"73610";"Saint-Alban-de-Montbel";"";"";"18031109";"02/04/2019";"";"";"Easy Vente Immo";"4 rue Saint Antoine";"73000";"Chambéry";"0612255693";"";"";"easyvente_095";"";"";"";"";"";"";"";"";"";"";"";"";"304";"17";"1555250908";"834090144";"CPI 7301 2018 000 023 739";"http://easyvente.netty.fr/immobilier/appartement-duplex-saint-alban-de-montbel-vente-fr_VA1962.htm";"";"0";"0";"0";"0";"NON";"250";"contact@easyventeimmo.fr";"Mantaut Marine";"OUI";"contact@easyventeimmo.fr";"";"";"";"";"";"";"";"";"0";"";"NON";"https://img.netty.immo/productw/easyvente/2/VA1962/1554812505_VA1962_7_l.jpg";"https://img.netty.immo/productw/easyvente/2/VA1962/1555249970_VA1962_18_l.jpg";"https://img.netty.immo/productw/easyvente/2/VA1962/1555249993_VA1962_19_l.jpg";"https://img.netty.immo/productw/easyvente/2/VA1962/1554812533_VA1962_9_l.jpg";"https://img.netty.immo/productw/easyvente/2/VA1962/1554812365_VA1962_17_l.jpg";"https://img.netty.immo/productw/easyvente/2/VA1962/1554812260_VA1962_12_l.jpg";"https://img.netty.immo/productw/easyvente/2/VA1962/1554812282_VA1962_13_l.jpg";"https://img.netty.immo/productw/easyvente/2/VA1962/1554812299_VA1962_14_l.jpg";"https://img.netty.immo/productw/easyvente/2/VA1962/1554812316_VA1962_15_l.jpg";"https://img.netty.immo/productw/easyvente/2/VA1962/1554812336_VA1962_16_l.jpg";"";"111962";"304";"E";"17";"C";"";"duplex";"";"";"";"";"0";"0";"0";"";"";"";"";"";"";"";"";"";"";"";"";"";"";"";"";"";"";"NON";"";"";"NON";"";"";"";"";"";"30";"";"";"";"";"";"";"";"";"";"";"";"";"NON";"";"";"";"";"";"";"";"";"";"";"";"";"";"";"0";"";"";"";"";"";"";"";"";"";"";"";"";"";"NON";"0";"0";"NON";"";"";"";"";"";"";"";"";"";"";"";"";"";"";"";"";"";"";"";"";"";"";"";"";"";"";"";"";"";"";"";"";"";"";"";"";"";"";"";"4.08-007";"2";"";"0";"0";"0";"0";"";"";""
"easyvente";"VA1966-EASYVENTE";"vente";"appartement";"73000";"Chambéry";"FR";"12 square de Joppet";"";"";"126000";"";"";"NON";"0";"66";"";"3";"2";"T3 66m2 avec garage et cave ";"Exclusivité<br><br>Chambéry - Quartier Joppet<br>Proche de toutes commodités dans un quartier calme et résidentiel avec de nombreux parkings et espaces verts.<br><br>Situé au 1er étage sans ascenseur d'une copropriété de 4 étages.<br>Découvrez cet appartement traversant composé d'un hall  d'entrée desservant: un salon séjour lumineux, une cuisine séparée (possibilité d'ouverture) une salle de bain, deux belles chambres avec placards et un WC séparé.<br><br>Un balcon donnant sur les espaces verts de la résidence offre une belle vue dégagée sur les montagnes très agréable.<br><br>Une cave et un garage viennent compléter cet appartement.<br><br>Contact et visites: Marine 06 12 25 56 93 <br>Mandat N° 1849. Honoraires à la charge du vendeur. Dans une copropriété. Quote-part moyenne du budget prévisionnel 900 €/an. Aucune procédure n'est en cours. <br>";"";"76";"1";"4";"NON";"1958";"";"1";"0";"1";"";"10240";"7";"OUI";"";"";"OUI";"1";"3";"";"OUI";"1";"0";"";"";"";"NON";"";"";"";"";"";"";"";"";"";"";"";"";"";"";"";"";"";"";"";"";"";"";"";"";"";"";"";"";"";"OUI";"";"";"";"";"OUI";"";"https://img.netty.immo/productw/easyvente/2/VA1966/1556788348_VA1966_26_l.jpg";"https://img.netty.immo/productw/easyvente/2/VA1966/1556787504_VA1966_15_l.jpg";"https://img.netty.immo/productw/easyvente/2/VA1966/1556787569_VA1966_16_l.jpg";"https://img.netty.immo/productw/easyvente/2/VA1966/1556787707_VA1966_18_l.jpg";"https://img.netty.immo/productw/easyvente/2/VA1966/1556787643_VA1966_17_l.jpg";"https://img.netty.immo/productw/easyvente/2/VA1966/1556787423_VA1966_14_l.jpg";"https://img.netty.immo/productw/easyvente/2/VA1966/1556787870_VA1966_20_l.jpg";"https://img.netty.immo/productw/easyvente/2/VA1966/1556787934_VA1966_21_l.jpg";"https://img.netty.immo/productw/easyvente/2/VA1966/1556788109_VA1966_23_l.jpg";"";"";"";"";"";"";"";"";"";"";"";"0612255693";"Marine MANTAUT";"contact@easyventeimmo.fr";"73000";"Chambéry";"";"";"1849";"26/04/2019";"";"";"Easy Vente Immo";"4 rue Saint Antoine";"73000";"Chambéry";"0612255693";"";"";"easyvente_001";"";"";"";"";"";"";"";"";"";"";"";"";"0";"0";"1556789646";"834090144";"CPI 7301 2018 000 023 739";"http://easyvente.netty.fr/immobilier/appartement-t3-chambery-vente-fr_VA1966.htm";"";"1";"0";"900";"0";"NON";"800";"contact@easyventeimmo.fr";"Mantaut Marine";"OUI";"contact@easyventeimmo.fr";"";"";"";"";"";"";"";"";"0";"";"OUI";"https://img.netty.immo/productw/easyvente/2/VA1966/1556788202_VA1966_24_l.jpg";"https://img.netty.immo/productw/easyvente/2/VA1966/1556292260_VA1966_9_l.jpg";"";"";"";"";"";"";"";"";"";"111966";"0";"";"0";"";"";"";"";"";"";"";"0";"0";"0";"";"";"";"";"";"";"";"";"";"";"";"";"";"";"";"";"";"";"NON";"";"";"NON";"";"";"";"";"";"17";"";"";"";"";"";"";"";"";"";"";"";"";"NON";"";"";"";"";"";"";"";"";"";"";"";"";"";"";"0";"";"";"";"";"";"";"";"";"";"";"";"";"";"OUI";"0";"900";"NON";"";"";"";"";"";"";"";"";"";"";"";"";"";"";"";"";"";"";"";"";"";"";"";"";"";"";"";"";"";"";"";"";"";"";"";"";"";"";"";"4.08-007";"2";"";"0";"0";"0";"0";"";"";""
"easyvente";"VA1994-EASYVENTE";"vente";"appartement";"73000";"Bassens";"FR";"243 Chemin de Gonrat";"";"";"171600";"";"";"NON";"0";"67";"";"3";"2";"Appartement à vendre Bassens";"<br>Mandat N° 18031110. Honoraires à la charge du vendeur. Dans une copropriété de 128 lots. Aucune procédure n'est en cours. <br>";"";"100";"1";"5";"NON";"1966";"";"0";"1";"1";"";"4608";"7";"";"";"";"";"9";"0";"";"OUI";"0";"0";"";"";"";"NON";"";"";"";"";"";"";"";"";"";"";"";"";"";"";"";"";"";"";"";"";"";"";"";"";"";"";"";"";"";"OUI";"";"";"";"";"OUI";"";"https://img.netty.immo/productw/easyvente/2/VA1994/1556829602_VA1994_1_l.jpg";"https://img.netty.immo/productw/easyvente/2/VA1994/1556829631_VA1994_2_l.jpg";"https://img.netty.immo/productw/easyvente/2/VA1994/1556829642_VA1994_3_l.jpg";"https://img.netty.immo/productw/easyvente/2/VA1994/1556829692_VA1994_6_l.jpg";"https://img.netty.immo/productw/easyvente/2/VA1994/1556829707_VA1994_7_l.jpg";"https://img.netty.immo/productw/easyvente/2/VA1994/1556829757_VA1994_10_l.jpg";"";"";"";"";"";"";"";"";"";"";"";"";"";"";"0612255693";"Sylvie Pontille";"contact@easyventeimmo.fr";"73000";"Bassens";"";"";"18031110";"29/04/2019";"";"";"Easy Vente Immo";"4 rue Saint Antoine";"73000";"Chambéry";"0612255693";"";"";"easyvente_095";"";"";"";"";"";"";"";"";"";"";"";"";"0";"0";"1557131301";"834090144";"CPI 7301 2018 000 023 739";"http://easyvente.netty.fr/immobilier/appartement-t3-bassens-vente-fr_VA1994.htm";"";"1";"128";"0";"0";"NON";"800";"contact@easyventeimmo.fr";"Mantaut Marine";"OUI";"contact@easyventeimmo.fr";"";"";"";"";"";"";"";"";"0";"";"NON";"";"";"";"";"";"";"";"";"";"";"";"111994";"0";"";"0";"";"";"";"";"";"";"";"0";"0";"0";"";"";"";"";"";"";"";"";"";"";"";"";"";"";"";"";"";"";"NON";"";"";"NON";"";"";"";"";"";"20";"";"";"";"";"";"";"";"";"";"";"";"";"NON";"";"";"";"";"";"";"";"";"";"";"";"";"";"";"0";"";"";"";"";"";"";"";"";"";"";"";"";"";"OUI";"128";"0";"NON";"";"";"";"";"";"";"";"";"";"";"";"";"";"";"";"";"";"";"";"";"";"";"";"";"";"";"";"";"";"";"";"";"";"";"";"";"";"";"";"4.08-007";"2";"";"0";"0";"0";"0";"";"";""
"easyvente";"VM272-EASYVENTE";"vente";"maison";"74960";"Meythet";"FR";"2 rue ambroise croizat";"";"";"575000";"";"";"NON";"0";"178";"555";"7";"4";"Maison 178 m2 Meythet Annecy";"Idéalement située dans le quartier résidentiel calme de Meythet, à 10 min du centre historique d'Annecy, et proche des commerces, écoles, transports, venez découvrir cette belle et spacieuse maison:<br>L'entrée de la maison dessert le 1er étage, composée de 2 chambres, d'une salle de bain, d'un WC séparé d'une cuisine équipée (possibilité d'ouverture  sur le séjour). Le séjour de 30m2 spacieux, lumineux composée d'une cheminée et un beau parquet en bois massif, est un lieu agréable de détente. Enfin une grande terrasse idéalement exposée plein Sud est accessible à la fois par le salon et par la cuisine.<br>Au rez de chaussé se trouve un grand garage disposant d'ouvertures extérieures d'une porte de garage électrique offrant la possibilité de rentrer 4 véhicules ainsi que de nombreux rangements. Au même niveau une chaufferie indépendante et un accès facile à une grande cave en sous sol ainsi qu'aux niveaux supérieurs de la maison.<br>En suite à l'étage dont l'accès se fait par le hall d'entrée de la maison vous trouverez une pièce très spacieuse pouvant être divisée pour créer deux pièces. dans la continuité un pallier dessert à gauche une très grande salle de douche composée d'un WC, une chambre spacieuse et très grande pièce disposant d'arrivées d'eau, d'électricité et d'une aération hotte pour y installer éventuellement une cuisine.<br>Ce dernier étage peut être rendu complètement indépendant (montée indépendante, cuisine, salle de bain, séjour, plusieurs pièces et chambres) pour une éventuelle location, indépendance des enfants etc.<br>La maison est construite sur un beau terrain arboré de 555m2.<br>Visite virtuelle, infos et photos disponible sur le site easyventeimmo. Bien vendu entre particuliers pas d'honoraires.<br><br>Mandat N° 1821. Honoraires à la charge du vendeur.  <br>";"";"0";"";"3";"NON";"1971";"";"0";"2";"2";"";"8704";"7";"OUI";"";"";"";"0";"0";"";"";"2";"3";"";"";"";"OUI";"";"";"";"";"";"";"";"";"";"";"";"";"";"";"";"";"";"";"";"";"";"";"";"";"";"";"";"";"";"";"";"";"";"";"";"";"https://img.netty.immo/productw/easyvente/2/VM272/1548847477_VM272_23_l.jpg";"https://img.netty.immo/productw/easyvente/2/VM272/1548847435_VM272_16_l.jpg";"https://img.netty.immo/productw/easyvente/2/VM272/1548847485_VM272_24_l.jpg";"https://img.netty.immo/productw/easyvente/2/VM272/1548847490_VM272_25_l.jpg";"https://img.netty.immo/productw/easyvente/2/VM272/1548847418_VM272_13_l.jpg";"https://img.netty.immo/productw/easyvente/2/VM272/1526906586_VM272_2_l.jpg";"https://img.netty.immo/productw/easyvente/2/VM272/1548847461_VM272_20_l.jpg";"https://img.netty.immo/productw/easyvente/2/VM272/1526907580_VM272_4_l.jpg";"https://img.netty.immo/productw/easyvente/2/VM272/1548847384_VM272_8_l.jpg";"";"";"";"";"";"";"";"";"";"";"";"0612255693";"Marine MANTAUT";"contact@easyventeimmo.fr";"74960";"Meythet";"";"";"1821";"15/11/2018";"";"";"Easy Vente Immo";"4 rue Saint Antoine";"73000";"Chambéry";"0612255693";"";"";"easyvente_001";"";"";"";"";"";"";"";"";"";"";"";"";"253";"31";"1553158464";"834090144";"CPI 7301 2018 000 023 739";"http://easyvente.netty.fr/immobilier/maison-traditionnelle-meythet-vente-fr_VM272.htm";"";"0";"0";"0";"0";"NON";"840";"contact@easyventeimmo.fr";"Mantaut Marine";"OUI";"contact@easyventeimmo.fr";"";"";"";"";"";"";"";"";"0";"";"NON";"https://img.netty.immo/productw/easyvente/2/VM272/1548847389_VM272_9_l.jpg";"https://img.netty.immo/productw/easyvente/2/VM272/1548847398_VM272_7_l.jpg";"https://img.netty.immo/productw/easyvente/2/VM272/1526907588_VM272_5_l.jpg";"https://img.netty.immo/productw/easyvente/2/VM272/1548847414_VM272_12_l.jpg";"https://img.netty.immo/productw/easyvente/2/VM272/1548847423_VM272_14_l.jpg";"https://img.netty.immo/productw/easyvente/2/VM272/1548847408_VM272_11_l.jpg";"https://img.netty.immo/productw/easyvente/2/VM272/1548847440_VM272_17_l.jpg";"https://img.netty.immo/productw/easyvente/2/VM272/1548847449_VM272_19_l.jpg";"https://img.netty.immo/productw/easyvente/2/VM272/1548847472_VM272_22_l.jpg";"https://img.netty.immo/productw/easyvente/2/VM272/1548847466_VM272_21_l.jpg";"";"12272";"253";"E";"31";"D";"";"maison traditionnelle";"";"";"";"";"0";"0";"0";"";"";"";"";"";"";"";"";"";"";"";"";"";"";"";"";"";"";"NON";"";"";"NON";"";"";"";"";"";"30";"";"";"";"";"";"";"";"";"";"";"";"";"NON";"";"";"";"";"";"";"";"";"";"";"";"";"";"";"1";"";"";"";"";"";"";"";"";"";"";"";"";"";"NON";"0";"0";"NON";"";"";"";"";"";"";"";"";"";"";"";"";"";"";"";"";"";"";"";"";"";"";"";"";"";"";"";"";"";"";"";"";"";"";"";"";"";"";"";"4.08-007";"2";"";"0";"0";"0";"0";"";"";""
"easyvente";"VM276-EASYVENTE";"vente de prestige";"maison";"73210";"Mâcot-la-Plagne";"FR";"939 route d'Aime";"";"";"595000";"";"";"NON";"0";"175";"1700";"6";"4";"Maison 6pièces 175m2 Macôt la Plagne";"Maison de 175 m2 construite sur un terrain de 1700 m2, idéalement située à la Plagne Tarentaise (Macôt la Plagne), et à proximité du centre d'Aime et de toutes commodités: écoles, transports en commun, zone commerciale. Proximité directe Stations de Ski.<br>L'entrée de la maison se fait par un petit hall qui donne accès directement sur le séjour. Il dessert également la buanderie, un WC indépendant et l'accès au garage en demi sous-sol.<br>Dans le prolongement du séjour, se trouve la cuisine aménagée et équipée, et donne accès à une véranda de 30 m2 (isolée et chauffée grâce à un poêle) permettant ainsi un espace de réception supplémentaire.<br>Le salon légèrement surélevé est également ouvert sur le séjour et bénéficie d'une très belle vue sur les montagnes, il est composé de nombreux rangements et d'un très grand bureau fait sur mesure.<br>Toujours au rez de chaussé se trouve une chambre avec une salle de douche.<br>A l'étage se trouve trois chambres lumineuses et spacieuses ainsi qu'une grande salle de bain composée d'une douche, d'une baignoire, d'une vasque et d'un WC.<br>Coté extérieur, l'entretien est irréprochable : Le jardin est composé de 2 terrasses exposées Sud-Ouest et Sud-Est, d'une allée goudronnée qui donne accès à un espace parking et aux 2 garages avec portes électriques. Le jardin arboré est composé d'un abri d'été, l'aménagement des abords de la maison fait avec goût.<br>A noter :<br>- De nombreux rangements<br>- Ensoleillement toute la journée grâce à sa triple exposition<br><br>Mandat N° 18031102.  <br>";"";"0";"";"2";"NON";"2004";"OUI";"1";"1";"2";"";"256";"6";"OUI";"";"OUI";"";"0";"0";"";"OUI";"3";"2";"";"";"";"NON";"";"";"";"";"";"";"";"";"";"";"";"";"";"";"";"";"";"";"";"";"";"";"";"";"";"";"";"";"";"OUI";"";"";"";"";"";"";"https://img.netty.immo/productw/easyvente/2/VM276/1528742954_VM276_3_l.jpg";"https://img.netty.immo/productw/easyvente/2/VM276/1528742946_VM276_1_l.jpg";"https://img.netty.immo/productw/easyvente/2/VM276/1528743001_VM276_6_l.jpg";"https://img.netty.immo/productw/easyvente/2/VM276/1528742951_VM276_2_l.jpg";"https://img.netty.immo/productw/easyvente/2/VM276/1528742997_VM276_5_l.jpg";"https://img.netty.immo/productw/easyvente/2/VM276/1528743010_VM276_7_l.jpg";"https://img.netty.immo/productw/easyvente/2/VM276/1528743041_VM276_8_l.jpg";"https://img.netty.immo/productw/easyvente/2/VM276/1528743048_VM276_9_l.jpg";"https://img.netty.immo/productw/easyvente/2/VM276/1528743081_VM276_10_l.jpg";"";"";"";"";"";"";"";"";"";"";"";"0612255693";"Marine MANTAUT";"contact@easyventeimmo.fr";"73210";"Mâcot-la-Plagne";"";"";"18031102";"13/02/2018";"";"";"Easy Vente Immo";"4 rue Saint Antoine";"73000";"Chambéry";"0612255693";"";"";"easyvente_001";"";"";"";"";"";"";"";"";"";"";"";"";"192";"57";"1548757040";"834090144";"CPI 7301 2018 000 023 739";"http://easyvente.netty.fr/immobilier/maison-villa-macot-la-plagne-vente-fr_VM276.htm";"";"0";"0";"0";"0";"NON";"1444";"contact@easyventeimmo.fr";"Mantaut Marine";"OUI";"contact@easyventeimmo.fr";"";"";"";"";"";"";"";"";"0";"";"NON";"https://img.netty.immo/productw/easyvente/2/VM276/1528743086_VM276_11_l.jpg";"https://img.netty.immo/productw/easyvente/2/VM276/1528743123_VM276_13_l.jpg";"https://img.netty.immo/productw/easyvente/2/VM276/1528743128_VM276_14_l.jpg";"https://img.netty.immo/productw/easyvente/2/VM276/1528743102_VM276_12_l.jpg";"";"";"";"";"";"";"";"12276";"192";"D";"57";"F";"";"villa";"";"";"";"";"0";"0";"0";"";"";"";"";"";"";"";"";"";"";"";"";"";"";"";"";"";"";"NON";"";"";"NON";"";"";"";"";"";"50";"";"";"";"";"";"";"";"";"";"";"";"";"NON";"";"";"";"";"";"";"";"";"";"";"";"";"";"";"0";"";"";"";"";"";"";"";"";"";"";"";"";"";"NON";"0";"0";"NON";"";"";"";"";"";"";"";"";"";"";"";"";"";"";"";"";"";"";"";"";"";"";"";"";"";"";"";"";"";"";"";"";"";"";"";"";"";"";"";"4.08-007";"1";"";"0";"0";"0";"0";"";"";""
"easyvente";"VM280-EASYVENTE";"vente";"maison";"07160";"Le Chambon";"FR";"nicoule";"";"";"338500";"";"";"NON";"0";"133";"3000";"7";"4";"Superbe chalet Ardéchois en bois";"Dans un magnifique cadre de nature préservée au coeur de l'Ardèche, nous vous invitons à venir découvrir ce magnifique chalet intégralement construit en bois et pierres naturelles sur un terrain de 2000m2.<br>Ce chalet bénéficie de prestations de qualité, meubles et équipements de cuisine et de salle de bain haut de gamme, radiateurs électriques basse température en pierre de lave, poêle à bois, fenêtres et baies vitrées en double vitrage avec moustiquaires coulissantes intégrées.<br>Un espace de stationnement gravillonné entoure le chalet coté garage. Le sous sol de 120m2 semi-enterré, habillé de pierres naturelles, comporte un espace de stationnement, un point d'eau, une buanderie, des espaces de rangement et un escalier menant à l'intérieur du chalet.<br>Cet escalier dessert le rez de chaussé composé d'une chambre avec placards, d'une salle d'eau avec douche à l'italienne WC et double vasque, d'une cuisine équipée et ouverte sur le salon séjour lumineux donnant lui même accès a une grande terrasse exposée Sud ouest.<br>L'étage dispose d'un hall spacieux desservant 3 chambres tourtes équipées de placards coulissants, une salle d'eau et des toilettes indépendantes.<br>A l'extérieur se trouve en plus de la belle terrasse, un cabanon de jardin en pierre, un abris et un petit ruisseau.<br>Bien vendu entre particuliers pas de commission d'agence, nous vous mettons en relation avec le propriétaire.<br><br>Mandat N° 18031103.  <br>";"";"0";"";"3";"OUI";"2008";"";"0";"2";"2";"";"";"8";"";"";"OUI";"OUI";"0";"0";"";"OUI";"3";"1";"";"";"";"NON";"";"";"";"";"";"";"";"";"";"";"";"";"";"";"";"";"";"";"";"";"";"";"";"";"";"";"";"";"";"OUI";"";"";"";"";"";"";"https://img.netty.immo/productw/easyvente/2/VM280/1529430081_VM280_1_l.jpg";"https://img.netty.immo/productw/easyvente/2/VM280/1529430162_VM280_10_l.jpg";"https://img.netty.immo/productw/easyvente/2/VM280/1529430188_VM280_12_l.jpg";"https://img.netty.immo/productw/easyvente/2/VM280/1529430092_VM280_2_l.jpg";"https://img.netty.immo/productw/easyvente/2/VM280/1529430111_VM280_3_l.jpg";"https://img.netty.immo/productw/easyvente/2/VM280/1529430120_VM280_4_l.jpg";"https://img.netty.immo/productw/easyvente/2/VM280/1529430137_VM280_8_l.jpg";"https://img.netty.immo/productw/easyvente/2/VM280/1529430226_VM280_5_l.jpg";"https://img.netty.immo/productw/easyvente/2/VM280/1529430128_VM280_6_l.jpg";"";"";"";"";"";"";"";"";"";"";"";"0612255693";"Marine MANTAUT";"contact@easyventeimmo.fr";"07160";"Le Chambon";"";"";"18031103";"24/04/2018";"";"";"Easy Vente Immo";"4 rue Saint Antoine";"73000";"Chambéry";"0612255693";"";"";"easyvente_001";"";"";"";"";"";"";"";"";"";"";"";"";"261";"12";"1529597843";"834090144";"CPI 7301 2018 000 023 739";"http://easyvente.netty.fr/immobilier/maison-chalet-le-chambon-vente-fr_VM280.htm";"";"0";"0";"0";"0";"NON";"840";"contact@easyventeimmo.fr";"Mantaut Marine";"OUI";"contact@easyventeimmo.fr";"";"";"";"";"";"";"";"";"0";"";"NON";"https://img.netty.immo/productw/easyvente/2/VM280/1529430133_VM280_7_l.jpg";"https://img.netty.immo/productw/easyvente/2/VM280/1529430183_VM280_11_l.jpg";"https://img.netty.immo/productw/easyvente/2/VM280/1529430157_VM280_9_l.jpg";"";"";"";"";"";"";"";"";"12280";"261";"E";"12";"C";"";"chalet";"";"";"";"";"0";"0";"0";"";"";"";"";"";"";"";"";"";"";"";"";"";"";"";"";"";"";"NON";"";"";"NON";"";"";"";"";"";"0";"";"";"";"";"";"";"";"";"";"";"";"";"NON";"";"";"";"";"";"";"";"";"";"";"";"";"";"";"0";"";"";"";"";"";"";"";"";"";"";"";"";"";"NON";"0";"0";"NON";"";"";"";"";"";"";"";"";"";"";"";"";"";"";"";"";"";"";"";"";"";"";"";"";"";"";"";"";"";"";"";"";"";"";"";"";"";"";"";"4.08-007";"1";"338000";"0";"0";"0";"0";"";"";""
